she is capable of teaching both english and french .	dia mampu mengajar bahasa inggris maupun bahasa prancis .
you may leave your bag here .	kau bisa meninggalkan tasmu di sini .
my family is a large one .	keluargaku adalah keluarga besar .
i ll work hard .	saya akan bekerja keras .
tom took charge of the situation .	tom mengambil alih situasi .
you don t have to believe me .	kamu tidak harus memercayaiku .
i ll never forget tom s face .	aku tidak akan pernah melupakan wajah tom .
his writing is very subjective .	tulisannya sangat subjektif .
the show s about to start .	acara akan segera dimulai .
excuse me , what time is it ?	permisi , sekarang jam berapa ya ?
are you hungry ?	apa kau lapar ?
i wrote three letters last night .	aku menulis tiga pucuk surat semalam .
he works at a bank .	dia bekerja di bank .
i have a large collection of stamps .	aku memiliki banyak koleksi perangko .
i m speaking with my student .	aku sedang berbicara dengan muridku .
it s no joke .	ini bukan lelucon .
tom looks pale .	tom terlihat pucat .
tom has a headache .	tom sakit kepala .
tom is deaf .	tom tuli .
i don t want to live with that .	aku tidak mau tinggal dengan itu .
you should be more reasonable .	kau harus menjadi lebih rasional .
may i run with you ?	bolehkah aku berlari bersamamu ?
tom is reading a book .	tom sedang membaca buku .
i don t think tom would like living here .	aku rasa tom tidak akan suka tinggal di sini .
do you understand me , tom ?	apakah kamu memahami maksudku , tom ?
what should i wear ?	baju mana yang mesti aku pakai ?
is there an atm near here ?	apakah ada atm di dekat sini ?
that isn t a secret .	itu bukan rahasia .
please turn on the radio .	tolong nyalakan radionya .
tom never saw mary again .	tom tidak pernah melihat mary lagi .
customs officials carried out a full body search on tom .	petugas bea dan cukai melakukan pemeriksaan badan terhadap tom .
are you at home ?	apa kamu ada di rumah ?
tom worked all day .	tom bekerja sepanjang hari .
i like sausage .	aku suka sosis .
is everything ok here ?	apakah semuanya oke di sini ?
i don t know either tom or his brother .	aku tidak tahu apakah tom atau saudara laki lakinya
tom seems very angry , doesn t he ?	tom kelihatannya sangat marah , ya ?
it doesn t make economic sense .	itu tidak masuk akal secara ekonomi .
could i borrow your car ?	bolehkah aku meminjam mobilmu ?
i didn t know where it came from .	saya tidak tau darimana itu berasal
traffic lights are used to regulate traffic .	lampu lalu lintas digunakan untuk mengatur lalu lintas .
escape was impossible .	melarikan diri itu mustahil .
that doll is scary .	boneka itu seram .
tom is much more relaxed when mary isn t around .	tom jauh lebih santai ketika mary tidak ada .
we talked over the phone .	kami berbicara melalui telepon .
why is he here ?	kenapa dia ada di sini ?
please fill out this form .	silakan isi formulir ini .
where can i catch a bus ?	di mana saya bisa menaiki sebuah bus ?
could i speak to you for a moment , tom ?	dapatkah saya berbicara denganmu sebentar , tom ?
i don t want to say that to my girlfriend .	aku tidak mau mengatakan itu pada pacarku .
they hugged each other .	mereka saling berpelukan .
i like dark red better .	aku lebih suka merah tua .
we took the enemy by surprise .	kami dikejutkan oleh musuh .
we compared his work with hers .	kami membandingkan pekerjaan dia dengan pekerjaan dia .
he can swim fast .	dia dapat berenang dengan cepat .
we should ve known tom would be late .	kita seharusnya tahu kalau tom akan terlambat .
a car is faster than a bicycle .	mobil lebih cepat daripada sepeda .
he died of lung cancer .	dia meninggal karena kanker paru paru .
i really do just want to go .	aku benar benar cuma ingin pergi .
tom s hands are dirty .	tangan tom kotor .
he speaks five languages .	dia berbicara lima bahasa .
you should ask tom directly .	kamu perlu bertanya langsung ke tom .
did you buy anything to eat ?	apakah anda membeli sesuatu untuk dimakan ?
i need some paper .	aku perlu kertas .
you had better not play on his generous nature .	lebih baik kamu tidak mengambil keuntungan dari kebaikan hatinya .
nothing can stop me .	tidak ada yang bisa menghentikanku .
he was looking at the sky .	dia sedang melihat langit .
i love hanging out with my friends .	aku suka pergi berkumpul dengan teman temanku .
where are they ?	di mana mereka ?
the thief forced her to hand over the money .	perampok itu memaksanya untuk menyerahkan uangnya .
we had to let tom go .	kita harus membiarkan tom pergi .
why don t you ever wash the dishes ?	kenapa kau tidak pernah mencuci piring piringnya ?
tom was arrested .	tom ditangkap .
tom is allergic to honey .	tom alergi terhadap madu .
tom took a trip around the world .	tom pergi berkeliling dunia .
my son believes in santa claus .	anak laki lakiku percaya akan santa claus .
no matter where you go in holland , you ll see windmills .	ke mana pun kau pergi di belanda , kau akan melihat kincir angin .
the weather here is very unpredictable .	cuaca di sini sangat tidak dapat diprediksi .
i can pay no more than 50 a week for rent .	aku tidak bisa membayar lebih dari 50 seminggu untuk sewa .
what does ussr stand for ?	apa kepanjangan dari ussr ?
perhaps you re trying too hard .	mungkin kamu berusaha terlalu keras .
praising children is an important thing .	memuji anak adalah hal yang penting .
that doesn t interest me anymore .	saya tidak tertarik lagi dengan itu
this shirt is cheaper than that one .	baju ini lebih murah daripada yang itu .
what are you thinking about ?	apa yang sedang kamu pikirkan ?
i prefer poetry to novels .	aku lebih suka puisi daripada novel .
we were right .	kita benar .
now give me what i want .	sekarang berikan aku apa yang aku mau .
please tell the truth .	tolong ceritakan yang sebenarnya .
i promise .	aku janji .
our friendship will last a long time .	pertemanan kami akan bertahan lama .
there is nothing like summer and ice cream .	tidak ada yang lebih baik dari musim panas dan es krim .
my brother is a veterinarian .	kakak saya adalah seorang dokter hewan .
you didn t need to hurry .	kau tidak perlu terburu buru .
i often help tom do that .	aku sering membantu tom melakukan itu .
i can t read your mind .	saya tidak bisa membaca pikiran anda .
i travel with my family every year .	saya bepergian dengan keluarga saya setiap tahun .
tom s skull has been fractured .	tempurung kepala tom retak .
tom was all worn out .	tom benar benar kelelahan .
the ship was flying the american flag .	kapal itu mengibarkan bendera amerika .
i was a bum .	aku dulu gelandangan .
i forgot to turn off the tv .	aku lupa mematikan televisi .
could you wait a little while ?	dapatkah kamu menunggu sebentar ?
they keep forgetting to pay the bills .	mereka selalu lupa membayar tagihan .
how much does this umbrella cost ?	payung ini berapa harganya ?
that salesman looks pretty smart .	pramuniaga itu kelihatan sangat cerdas .
my shoelace got caught in the escalator .	tali sepatuku tersangkut di eskalator .
have you finished your lunch yet ?	apa kau sudah menghabiskan makan siangmu ?
when will you come back home ?	kapan anda pulang ke rumah ?
i think tom should eat more .	aku rasa tom harus makan lebih banyak .
i think i remember how to do that .	aku pikir aku sudah ingat bagaimana cara melakukannya .
tom showed me his photograph album .	tom menunjukkanku album fotonya .
tom sat down and crossed his legs .	tom duduk dan menyilangkan kakinya .
tom says he s feeling better today .	tom berkata dia merasa lebih baik hari ini .
tom is very careless .	tom sangat ceroboh .
i don t like chocolate .	aku tidak suka cokelat .
i know .	aku tahu .
i usually eat outside .	aku biasanya makan di luar .
thanks a bunch .	makasih banyak .
don t sit too close to the fire .	jangan duduk terlalu dekat dengan api .
let s not talk about it any more .	sebaiknya kita jangan membicarakan ini lagi .
how did you get it ?	bagaimana kamu bisa mendapatkannya ?
i can t hide my feelings .	aku tidak bisa menyembunyikan perasaanku .
she did not answer all the questions .	dia tidak menjawab semua pertanyaan .
we need cement and sand .	kami membutuhkan semen dan pasir .
feta cheese has a lot of salt .	keju feta mengandung banyak garam .
my younger brother is taller than me .	adik laki lakiku lebih tinggi dariku .
i m scared of cats .	aku takut kucing .
would you like another apple ?	apa kau mau apel lagi ?
please don t cut these trees down .	tolong jangan tebang pohon pohon ini .
i don t know what love is .	aku tidak tahu apa itu cinta .
tom realized it was time to leave .	tom menyadari sekarang adalah waktu untuk pergi .
don t you want to be rich ?	tidak maukah kamu menjadi kaya ?
tom hasn t told us what to buy yet .	tom belum memberi tahu kita apa yang harus dibeli .
we don t really have to sell our house .	kita tidak sampai harus menjual rumah kita .
my father passed away two years ago .	ayah saya meninggal dua tahun yang lalu .
now s your chance to do that .	sekaranglah kesempatanmu melakukan itu .
i will continue .	saya akan lanjutkan .
i used to go to the beach every summer when i was a kid .	saya sering pergi ke pantai setiap musim panas ketika aku masih anak anak
i can t live alone .	aku tidak bisa hidup seorang diri .
yukio mishima killed himself in 1970 .	yukio mishima bunuh diri pada tahun 1970 .
we d better do what they ask .	sebaiknya kita turuti saja kemauan mereka .
i d like to put something in the hotel safe .	aku mau menyimpan sesuatu di brankas hotel .
there is little food in the refrigerator .	ada sedikit makanan di kulkas .
i am afraid that he might get hurt .	saya kuatir , mungkin dia mendapatkan luka .
isn t that what they want ?	bukankah itu yang mereka inginkan ?
this is a pay phone .	ini telepon umum .
are you in a hurry ?	apa kamu sedang terburu buru ?
i want to say something to you .	ada hal yang ingin aku katakan padamu .
ok . i agree .	oke , aku setuju .
tom buys and sells old books .	tom membeli dan menjual buku buku tua .
i can t pronounce that name .	aku tidak bisa mengucapkan nama itu .
he likes to run .	dia suka berlari .
they know who he is .	mereka tahu siapa dia .
burj khalifa is currently the tallest skyscraper in the world .	burj khalifa adalah bangunan pencakar langit tertinggi di dunia saat ini .
how fascinating !	sangat menarik !
tom knows he hears something .	tom tahu dia mendengar sesuatu .
close the door .	tutup pintunya .
i wasn t talking about tom .	aku tidak sedang berbicara tentang tom .
i ll make you happy .	aku akan membuatmu bahagia .
i love mango pudding .	aku suka puding mangga .
i d like to stay for one night .	saya ingin menginap semalam .
tom will go far .	tom akan pergi jauh .
tom began to shout .	tom mulai berteriak .
we invited all our friends to the party .	kita mengundang semua teman kita ke pesta .
tom is going to do that again .	tom akan melakukan itu lagi .
i don t want to discuss tom s problems with you .	saya tidak mau mendiskusikan masalah tom denganmu .
tom is rude .	tom adalah seorang yang kasar .
tomorrow is payday .	besok hari gajian .
tom works from home .	tom bekerja dari rumah .
tom slipped out of the classroom .	tom menyelinap keluar kelas .
this building is going to be demolished .	bangunan ini akan dibongkar .
he hasn t returned yet .	dia belum kembali .
she says she likes flowers .	dia bilang , dia suka bunga .
it is a pity that he died so young .	sayang sekali dia meninggal di usia yang sangat muda .
you need to stay awake .	kamu harus tetap terjaga .
it s been a long time since i visited my grandmother .	sudah lama sejak saya mengunjungi nenek saya
don t make me go back there .	jangan membuatku kembali ke sana .
tom was fine .	tom dalam keadaan baik .
who am i talking with ?	dengan siapa saya bicara ?
that was the best decision i ve ever made .	itu keputusan terbaik yang pernah kubuat .
where does it hurt ?	sakitnya di mana ?
does tom like cheeseburgers ?	apakah tom suka burger keju ?
tom probably knows i don t like him .	tom mungkin tahu aku tidak menyukainya .
how many languages can you speak ?	berapa banyak bahasa yang bisa anda pahami ?
tom bought a new car for mary .	tom membeli mobil baru untuk mary .
he breathed deeply before entering his boss s office .	dia menarik napas yang dalam sebelum memasuki kantor bosnya .
five years have passed since they came to japan .	sudah lima tahun berlalu , semenjak mereka datang ke jepang .
tell me what you want .	katakan padaku apa yang kau inginkan .
we bought everything .	kami membeli semuanya .
it s been a long time since i ve worn a tie .	sudah lama aku tidak memakai dasi .
are you asleep ?	kamu sudah tidur ?
after the summer holidays , the children have to go back to school .	setelah libur musim panas , anak anak harus kembali ke sekolah .
tom s japanese is improving little by little .	kemampuan bahasa jepang tom meningkat sedikit demi sedikit .
who do you love more , your mom or your dad ?	siapa yang lebih kamu sayang , ibumu atau ayahmu ?
i have the ace of diamonds .	aku punya as wajik .
i have a business proposition for you .	aku memiliki tawaran bisnis denganmu .
what made you come here ?	apa yang membuatmu datang ke sini ?
i am a student at oxford university .	saya seorang mahasiswa di universitas oxford .
there were lots of cars .	ada banyak mobil .
i m allergic to synthetic rubber .	aku alergi pada karet sintetis .
i bought a book online .	aku membeli buku secara daring .
stop spending money on stupid things .	berhentilah mengeluarkan uang untuk hal yang tidak penting .
there s a fish .	ada seekor ikan .
have you turned in your report ?	sudahkah kamu menyerahkan laporanmu ?
air is a mixture of gases that we can t see .	udara adalah campuran dari gas yang tidak dapat kita lihat .
who did you get this from ?	anda dapat ini dari siapa ?
tom played with his sons .	tom bermain dengan putra putranya .
tom left boston a few days ago .	tom meninggalkan boston beberapa hari lalu .
do you want me to go with you ?	kamu ingin aku ikut denganmu ?
it s only a ten minute walk .	hanya sepuluh menitan berjalan kaki .
tom lost his way in the woods .	tom tersesat di hutan .
i just ate sushi and drank beer .	saya baru saja makan sushi dan minum bir .
i wonder who that girl is .	kira kira siapa ya anak perempuan itu ?
what re you drinking ?	kamu minum apa ?
remain seated .	tetaplah duduk .
i don t have anything to tell you .	tidak ada yang ingin kuberitahukan padamu .
it s our destiny .	ini adalah takdir kami .
did your wish come true ?	apakah harapanmu terkabul ?
i know tom won t give up .	aku tahu tom tidak akan menyerah .
who told you to do that ?	siapa yang menyuruhmu melakukan itu ?
if you don t want to miss the train , you d better hurry .	jika anda tidak ingin ketinggalan kereta , sebaiknya anda bergegas .
canadians aren t like that .	orang kanada tidak seperti itu .
we re very lucky to be alive .	kita beruntung sudah hidup .
we won the lottery .	kami menang lotre .
i will not tolerate this .	saya tidak akan membiarkan ini .
linux can be hacked , too .	linux juga bisa diretas .
this book costs 4 dollars .	buku ini harganya 4 dolar .
idiomatic expressions can seldom be translated word for word .	bentuk idiomatik jarang bisa diterjemahkan kata per kata .
my cat threw up on the carpet .	kucingku muntah di atas karpet .
she invited me to her birthday party .	dia mengundangku ke pesta ulang tahunnya .
what do you want to drink ?	mau minum apa ?
i thought you didn t care about money .	aku pikir kamu tidak peduli tentang uang .
soccer and the word soccer originated in england .	sepak bola dan kata soccer berasal dari inggris .
tom has two brothers who live in boston .	tom punya dua saudara lelaki yang tinggal di boston .
tom is panting .	tom terengah engah .
he s not here yet .	dia masih belum di sini .
whose car is this ?	mobil siapa ini ?
tom is going to arrive soon .	tom akan segera sampai .
do you believe in god ?	apakah anda percaya pada tuhan ?
have you ever been to america ?	pernah ke amerika ?
tom is a pilot .	tom adalah seorang pilot .
do we have to go to australia ?	apakah kita harus pergi ke australia ?
could you look at me , tom ?	dapatkah kamu melihatku , tom ?
does tom like swimming ?	apakah tom suka berenang ?
i m sorry i kept you waiting so long .	maaf membuatmu menunggu begitu lama .
she gave birth to a healthy baby .	dia melahirkan bayi yang sehat .
that s an order , tom .	ini perintah , tom .
i hate spiders .	aku benci laba laba laba .
what sports do you like ?	olahraga apa yang kau sukai ?
i ll call you when dinner s ready .	aku akan memanggilmu saat makan malamnya sudah siap .
it s night .	sekarang malam .
he doesn t know the truth yet .	dia belum tahu kebenarannya .
today is the last day of work .	hari ini hari terakhir kerja .
we re trapped !	kita terjebak !
don t go anywhere near that room .	jangan pergi ke dekat ruangan itu .
are you conservative ?	apa kau konservatif ?
i m not an idiot .	saya bukan idiot .
i haven t been swimming in a long time .	aku sudah tidak berenang dalam waktu yang lama .
we re confused .	kita bingung .
is that true ?	apa itu benar ?
the dog was in the box under the table .	anjing itu ada di dalam kotak di bawah meja .
you re reckless .	kamu ceroboh .
how old are you ?	umur kamu berapa ?
will you risk it ?	apa kamu mau mengambil risiko ?
i don t like the way tom cooks .	saya tidak menyukai cara tom memasak .
iodine is used to purify water .	yodium digunakan untuk menjernihkan air .
i m going there now .	saya ke sana sekarang .
are you sure you heard something ?	kamu yakin mendengar sesuatu ?
tom forgot to bring an umbrella .	tom lupa membawa payung .
tom can t run very fast .	tom tidak bisa lari dengan sangat cepat .
tom bought a new kite since his old one got stuck in a tree and he couldn t get it down .	tom membeli layang layang baru karena layang layang lamanya tersangkut di pohon dan dia tidak bisa menurunkannya .
tell me about your plan .	beritahu aku tentang rencanamu .
tom found a fossil .	tom menemukan sebuah fosil .
tom is left handed .	tom kidal .
this is worth one million yen .	ini senilai satu juta yen .
this is a gift from tom .	ini hadiah dari tom .
he acknowledged his fault .	dia mengakui kesalahannya .
i hugged her .	aku memeluk dia .
can you put it down on the table ?	dapatkah kamu meletakannya di meja ?
my life is different now .	hidup saya sekarang berbeda .
i don t know what i ll do .	aku tidak tahu apa yang akan kulakukan .
tom bought the cheapest one in the store .	tom membeli yang termurah dari toko itu .
when are you going home ?	kapan kamu pulang ke rumah ?
the train arrived on schedule .	kereta itu tiba sesuai jadwal .
i want everyone to hear what i have to say .	aku ingin semuanya mendengarkan apa yang aku katakan .
please give me something to drink .	tolong berikan saya sesuatu untuk diminum .
i passed by four houses .	aku melewati empat rumah .
ah , i see what you mean .	ah , aku paham maksudmu .
how s it going with you and tom ?	bagaimana hubunganmu dengan tom ?
tom waited for mary to come home .	tom menunggu mary pulang ke rumah .
i m sleepy .	aku ngantuk .
it s my ship .	itu kapalku .
i bought some shampoo and toothpaste .	aku membeli sampo dan pasta gigi .
she looks confused .	dia nampak bingung .
i don t like grapes .	aku tidak suka buah anggur .
he had dinner by himself .	dia makan malam sendiri .
we ve been asking the wrong kind of questions .	kita telah menanyakan jenis pertanyaan yang salah .
here s how the game works .	beginilah cara kerja permainan ini .
helen keller was blind , deaf and mute .	helen keller buta , tuli , dan bisu .
tom doesn t like the color of the walls in his bedroom .	tom tidak suka warna dinding kamar tidurnya .
tom explained it to me .	tom menjelaskannya padaku .
i took your umbrella by mistake .	aku salah membawa payungmu .
this won t take long .	ini tidak akan memakan waktu yang lama .
thank you very much for your recommendation .	terima kasih banyak atas saranmu .
tom is a student .	tom adalah seorang siswa .
i invited them to the party .	aku mengundang mereka ke pesta .
i never like to travel by train .	aku tidak pernah suka bepergian dengan kereta api .
tom is the newest member of our team .	tom anggota terbaru tim kami .
the atlantic ocean separates america from europe .	samudra atlantik memisahkan amerika dari eropa .
tom seems confused .	tom sepertinya kebingungan .
tom ran out of food .	tom kehabisan makanan .
it s six degrees below zero .	enam derajat dibawah nol .
i heard that tom plans to move to boston .	saya mendengar bahwa tom berencana pindah ke boston .
he kept on crying .	dia terus menangis .
does she have a piano ?	apakah ia memiliki sebuah piano ?
i lied .	aku berbohong .
tom goes to the supermarket almost every day .	tom pergi ke supermarket hampir setiap hari .
my house is big .	rumahku besar .
i want a lot more .	aku mau lebih banyak .
he is writing a novel .	dia sedang menulis novel .
what made you decide to come here ?	apa yang membuatmu memutuskan untuk datang kemari ?
do you also have this in other colors ?	apakah kamu juga punya ini dengan warna yang lain ?
your team is stronger than ours .	tim kalian lebih kuat ketimbang tim kami .
i can t see .	aku tidak bisa melihat .
these shirts are selling like hotcakes .	baju baju ini laku keras
i can t stand it anymore .	aku tidak tahan lagi .
you re sick !	kamu sakit !
whatever happened , it s over .	apapun yang terjadi , semuanya sudah berakhir .
the students didn t remember what they read in that book .	murid murid tidak ingat apa yang telah mereka baca di buku tersebut .
what does this mark mean ?	apa artinya tanda ini ?
someone is knocking on the door .	seseorang mengetuk pintu .
is everybody hungry ?	apa kalian lapar ?
take your hand out of your pocket .	keluarkan tanganmu dari sakumu .
this man is very , very old .	pria ini benar benar sangat tua .
i watch television .	aku menonton televisi .
these boxes are made out of plastic .	kotak kotak ini terbuat dari plastik .
are you home ?	apa kamu ada di rumah ?
they re both guilty .	mereka berdua bersalah .
i know you are clever .	aku tau kamu itu cerdik .
the difficult question is why .	pertanyaan yang sulit adalah kenapa .
i am very tired .	aku sangat capek .
do you want to pay with a credit card ?	apakah anda ingin membayar dengan kartu kredit ?
tom is waiting for your answer .	tom menunggu jawabanmu .
tom doesn t play football anymore .	tom sudah tidak bermain sepak bola lagi .
where is the railroad station ?	stasiun kereta apinya di mana ?
don t hesitate to ask for advice .	jangan sungkan untuk meminta saran .
when his wife died , he received dozens of letters of sympathy .	ketika istrinya meninggal dunia , dia menerima belasan surat belasungkawa .
i will write to you as soon as i can .	aku akan menulis surat untukmu sesegera mungkin .
we re lucky , aren t we ?	kami beruntung , kan ?
the keys were under the couch .	kuncinya ada di bawah sofa .
i want to find true love .	aku ingin menemukan cinta sejati .
i don t like this one .	saya tidak suka yang ini .
what s your job ?	pekerjaan anda apa ?
you have only to ask for it and it will be given to you .	kau hanya perlu memintanya dan itu akan diberikan kepadamu .
tom s smoking .	tom sedang merokok .
read this text carefully .	baca teks ini dengan saksama .
i can t give up now .	aku tidak boleh menyerah sekarang .
tom told mary he was a doctor .	tom memberitahu mary bahwa dia seorang dokter .
by the way , what are you going to do after this ?	omong omong , apa yang akan kamu lakukan setelah ini ?
which house did you live in ?	rumah mana yang kamu tinggali ?
they both agreed .	mereka berdua setuju .
he claimed that he had returned the book to the library .	dia mengatakan kalau dia sudah mengembalikan bukunya ke perpustakaan .
he has an uncontrollable temper .	dia punya temperamen yang tidak terkontrol .
it s near .	sudah dekat .
does he know what you did ?	apakah dia tahu apa yang kamu lakukan ?
the workers were proud of their work .	para pekerja bangga akan pekerjaannya .
we all got a christmas bonus .	kami semua mendapat bonus hari natal .
don t fight .	jangan bertengkar !
the news made him happy .	berita itu membuatnya bahagia .
we want to sell our car .	kami ingin menjual mobil kami .
the leopard does not change his spots .	biarpun kucing naik haji , pulang pulang mengeong juga
somebody knocked on the door .	ada yang mengetuk pintu .
tom can t have done it by himself .	tom tidak mungkin melakukannya seorang diri .
good friends are like stars . you don t always see them , but you know they are always there .	teman yang baik itu seperti bintang . kamu tidak selalu melihat mereka , tetapi kamu tahu bahwa mereka selalu ada .
i like your castle .	saya suka istana anda .
tom said that he s innocent .	tom berkata dia tidak bersalah .
he is above suspicion .	dia bebas dari kecurigaan .
show me that .	perlihatkan itu padaku .
he ll help you if you ask .	dia akan membantumu jika kau memintanya .
how could i not see this coming ?	bagaimana bisa aku tidak menyadari hal ini ?
she has pretty eyes .	dia memiliki mata yang cantik .
tomorrow i ll quit smoking .	besok saya akan berhenti merokok .
she smiled .	dia tersenyum .
your english has improved a lot .	bahasa inggrismu mengalami banyak peningkatan .
i m a college student .	aku adalah mahasiswa .
i met tom tonight .	aku bertemu tom malam ini .
we ve done it twice in three months .	kami telah melakukannya dua kali dalam tiga bulan .
i told you not to turn on the lights .	sudah saya katakan jangan menyalakan lampu .
i m tom s friend .	saya teman tom .
he was sitting on a bench with his eyes closed .	ia duduk di bangku dengan menutup matanya .
he was sound asleep .	dia tertidur lelap .
should i stay or should i go ?	haruskah aku tinggal atau haruskah aku pergi ?
more coffee , please .	tolong tambah kopinya .
there are a few shops next to my house .	ada beberapa toko di samping rumahku .
use your brain .	pakai otakmu !
thanks for this .	terima kasih untuk ini .
