i have no more ideas .	aku kehabisan ide .
we were so afraid .	kami sangat takut
that s curious .	itu aneh .
i ll stop procrastinating , starting tomorrow .	aku akan berhenti menunda nunda mulai besok .
let s go to the beach .	mari kita pergi ke pantai .
he is blind in one eye .	sebelah matanya buta .
don t make fun of me .	jangan mempermainkanku .
i was very hungry .	aku sangat lapar .
what s it we re waiting for here ?	untuk apa kita menunggu di sini ?
why are you still here ?	kenapa kamu masih di sini ?
this is my favorite bookstore .	ini adalah toko buku kesukaanku .
you re both fired .	kalian berdua dipecat .
i have a date with tom tonight .	malam ini saya kencan dengan tom .
i ve already paid for it .	saya sudah membayarnya .
we don t have much left to do .	sudah tidak banyak yang bisa kami lakukan .
tom has already been forgiven .	tom sudah dimaafkan .
please turn right .	tolong belok kanan .
this is too spicy .	ini terlalu pedas .
what time do you usually go to bed ?	jam berapa biasanya anda tidur ?
where are you going anyway ?	memangnya kamu mau pergi ke mana ?
where have you been ?	ke mana saja kamu ?
i don t expect you to be my friend .	aku tidak menyangka kalau kamu menjadi temanku .
he is trying to quit smoking .	dia sedang berusaha untuk berhenti merokok .
i m learning how to drive .	aku sedang belajar mengemudi .
the ice is very thick .	esnya sangat tebal .
the teacher assembled the students in the hall .	guru itu mengumpulkan para siswa di aula .
it was tom who asked the question .	tomlah yang bertanya .
you don t own me .	kamu tidak memilikiku .
i am a college student .	saya mahasiswa .
your hair is a mess .	rambutmu berantakan .
do you wash your hands before meals ?	apakah kamu mencuci tangan sebelum makan ?
tom is in australia this year .	tom sedang di australia tahun ini .
what causes this ?	apa yang menyebabkan ini ?
i don t have a car .	saya tidak memiliki mobil .
hang on just a second , tom .	tunggu sebentar , tom .
i should ve been able to do more .	seharusnya aku bisa melakukan lebih .
tom waited for the applause to die down before he announced the next song .	tom menunggu tepuk tangan mereda sebelum dia mengumumkan lagu selanjutnya .
who are you ?	siapa kamu ?
i know that you were looking for me this morning .	saya tahu anda mencari saya pagi ini .
books are my best friends .	buku adalah teman terbaikku .
where is the newspaper ?	korannya mana ?
stop that !	hentikan itu !
keep driving .	teruslah mengemudi .
fortunately , no one was hurt .	untungnya , tidak ada yang terluka .
mercury is the smallest planet in our solar system .	merkurius adalah planet terkecil dalam tata surya kita .
this soup is really delicious , isn t it ?	sup ini benar benar lezat , ya ?
thomas edison invented the light bulb .	thomas edison menciptakan bola lampu .
what are you drinking ?	kamu minum apa ?
let us go home .	mari kita pulang .
i can t imagine why tom would do that .	aku tidak bisa membayangkan kenapa tom harus melakukan itu .
british people are used to standing in queues .	orang inggris terbiasa untuk berdiri untuk mengantri .
tom didn t even ask for my permission .	tom bahkan tidak meminta izinku .
i hope i ll see you again soon .	saya harap saya dapat bertemu anda lagi , segera .
how does it look ?	bagaimana kelihatannya ?
tom rolled his window back up .	tom menutup kaca jendelanya .
her skin is as white as snow .	kulitnya seputih salju .
that table is dirty .	meja itu kotor .
we might find something .	kita mungkin bisa menemukan sesuatu .
you may close the door .	kamu boleh menutup pintunya .
tom goes for a walk every morning .	tom pergi jalan jalan setiap pagi .
tom isn t the only one that wants to leave .	tom bukanlah satu satunya yang ingin pergi .
you re not ready yet .	kamu belum siap .
i think i ll go now .	aku pikir aku akan pergi sekarang .
tom and mary studied together .	tom dan mary belajar bersama .
i use twitter .	saya menggunakan twitter .
please don t move .	tolong jangan bergerak .
i saw tom and mary leave together .	saya melihat tom dan mary berangkat bersama .
the medicine made me sleepy .	obat itu membuatku mengantuk .
tom has never had a mustache .	tom tak pernah berkumis .
mary and alice often wear the same thing .	mary dan alice sering mengenakan pakaian yang sama .
tom knows exactly what this is all about .	tom tahu persis apa yang ada dibalik semua ini .
you should have come earlier .	seharusnya kamu datang lebih awal .
the front door is open .	pintu depan terbuka .
that should be enough .	itu cukup .
i stayed .	aku tetap tinggal .
my cell phone doesn t work .	ponsel saya tidak berfungsi .
i ll clean my room tomorrow .	besok aku akan membersihkan kamarku .
tom went shopping for dog food .	tom pergi membeli makanan anjing .
see you tomorrow .	sampai ketemu besok .
i found somebody .	aku menemukan seseorang .
don t leave !	jangan pergi !
i ve caught a bad cold .	aku terkena flu berat .
cats are animals .	kucing itu hewan .
do you know anyone who teaches french ?	apakah kamu kenal seseorang yang mengajar bahasa prancis ?
he took tom on a fishing trip .	dia mengajak tom pergi memancing .
fire is always dangerous .	api selalu berbahaya .
i want to be a doctor .	saya ingin menjadi seorang dokter .
she looked ill .	dia terlihat sakit .
he is not always busy in the morning .	dia selalu sibuk di pagi hari .
why are you opposed to this ?	kenapa kalian kontra dengan ini ?
every day is a gift .	setiap hari adalah hadiah .
does tom like sci fi movies ?	apakah tom suka film fiksi ilmiah ?
she goes to the library every other day .	dia pergi ke perpustakaan dua hari sekali .
can i ask you a favor ?	boleh minta tolong ?
you look very charming today .	kau terlihat sangat menawan hari ini .
the stamp came off .	perangkonya lepas .
tom didn t like the taste much .	tom tidak terlalu suka rasanya .
you should get back home .	kamu sebaiknya pulang ke rumah .
that s odd .	itu aneh .
why didn t you call me yesterday evening ?	mengapa kamu tidak meneleponku kemarin malam ?
my bicycle needs to be repaired .	sepeda saya perlu diperbaiki .
a woman whose husband is dead is called a widow .	seorang wanita , yang suaminya meninggal , disebut janda .
the gate is closed at eight .	gerbangnya ditutup jam delapan .
this room is cramped .	ruangannya sempit .
you still have a lot to learn .	kamu masih harus belajar banyak .
tom waited for mary to say something , but she remained silent .	tom menunggu mary untuk mengungkap sesuatu , tetapi dia tetap terdiam .
the kids are playing outside .	anak anak sedang bermain di luar .
i ve lost my ticket .	aku kehilangan tiketku .
everyone believed his lie .	semua orang mempercayai kebohongannya .
this is your wine .	ini anggurmu .
tom sat at his desk reading a report .	tom duduk membaca laporan di mejanya .
are you down there ?	apakah kamu di sana ?
i ve heard everything .	aku sudah mendengar semuanya .
i love sports . i get that from my father .	aku suka olahraga . itu menurun dari ayahku .
we must start at the beginning .	kita harus mulai dari awal .
when did tom buy that ?	kapan tom membeli itu ?
tom waited .	tom menunggu .
do you know each other ?	apakah kalian saling mengenal ?
what do you want to do ?	apa yang ingin kau lakukan ?
this is for internal use .	ini untuk penggunaan dalam .
tom must be asleep .	tom pasti tertidur .
tom pointed to the chair next to his .	tom menunjuk kursi disebelahnya .
why didn t you come ?	kenapa kau tidak datang ?
you ll need either a pen or a pencil .	kamu akan membutuhkan pulpen atau pensil .
where s boston ?	boston itu di mana ?
what tom did was wrong .	yang tom lakukan itu salah .
tom bought a camera to give to mary on her birthday .	tom membeli sebuah kamera untuk diberikan kepada mary pada hari ulang tahunnya .
say goodbye to your friends .	pamitlah pada teman temanmu .
i don t know what that means .	aku tidak tahu apa artinya itu .
i ll give it back .	aku akan mengembalikannya .
i don t remember tom s last name .	aku tidak ingat nama marga tom .
you should obey the traffic laws when you drive .	anda harus mematuhi aturan lalu lintas saat berkendara .
math is hard for me .	matematika sulit bagi saya .
i m reading a letter .	aku sedang membaca surat .
do you eat lunch in the classroom ?	apa kamu makan siang di kelas ?
no one is doing anything .	tidak ada yang melakukan apa apa .
the heat was so intense that i fainted .	suhunya sangat panas hingga aku pun pingsan .
are you going to tell tom that you ve spent time in prison ?	akankah kau katakan pada tom bahwa kamu pernah dipenjara ?
he went to the shop .	dia pergi ke toko .
tom slipped and fell .	tom jatuh tergelincir .
i m a free man .	aku adalah lelaki yang bebas .
are you meeting someone here ?	apakah kau akan menemui seseorang di sini ?
i didn t cheat on the test .	saya tidak menyontek saat ujian .
the problem is tom didn t do what he said he d do .	masalahnya tom tidak melakukan apa yang dia bilang dia akan lakukan .
we won the lottery .	kami memenangkan undian itu .
tom looks suspicious .	tom terlihat mencurigakan .
i want the other one .	saya ingin yang satunya .
i m better than you .	aku lebih baik daripada kamu .
tom s insane .	tom gila .
he is ill .	dia sakit .
raise your hands .	angkat tanganmu .
does tom like to swim ?	apakah tom suka berenang ?
tom was raised by his uncle .	tom dibesarkan oleh pamannya .
tom had to do some work .	tom harus melakukan beberapa perkerjaan .
i attend a private school .	aku bersekolah di sekolah swasta .
you re tired , aren t you ?	kamu lelah , ya ?
tom asked for permission to leave early .	tom meminta izin untuk pulang lebih awal .
i wish i was dead .	aku harap aku mati .
are you still planning to go to australia next month ?	apakah kamu masih berencana pergi ke australia bulan depan ?
have you finished your lunch yet ?	sudahkan kau menghabiskan makan siangmu ?
this program has both downloading and uploading capabilities .	program ini memiliki kemampuan baik mengunduh maupun mengunggah .
how can we change that ?	bagaimana kita bisa mengubah itu ?
we stayed at a three star hotel .	kami menginap di hotel bintang tiga .
i ve already arranged it .	saya sudah mengaturnya .
i can t eat chocolate .	saya tidak boleh makan cokelat .
they want tom to be their leader .	mereka ingin tom menjadi pemimpin mereka .
i was absent from the party .	aku tidak hadir dalam pesta itu .
tom hugged his father .	tom memeluk ayahnya .
i am ashamed about what happened yesterday .	saya malu dengan kejadian kemarin .
pizza is my favorite food .	piza adalah makanan favoritku .
tom is impatient , isn t he ?	tom tidak sabaran , ya ?
she opens the window .	dia membuka jendela .
can we use a calculator ?	bolehkah kami menggunakan kalkulator ?
what s your favorite item of clothing ?	pakaian apa yang paling kamu sukai ?
the train was about to leave .	keretanya sudah akan berangkat .
why did you let tom go to boston by himself ?	kenapa kamu membiarkan tom pergi ke boston sendirian ?
the hole is big enough .	lubang itu lumayan besar .
how long do horses live ?	berapa lama kuda hidup ?
read this book .	bacalah buku ini .
during the night , everything looks different .	pada malam hari , semuanya terlihat berbeda .
tom grabbed the book from mary .	tom merebut buku itu dari mary .
she died .	dia meninggal .
what secret is tom hiding ?	rahasia apa yang tom sembunyikan ?
do you travel a lot ?	apakah anda banyak melakukan perjalanan ?
i don t think that that s true .	saya tidak mengira itu benar
her mother is writing a letter .	ibunya sedang menulis surat .
i want mine .	aku mau punyaku .
a rush hour traffic jam delayed my arrival by two hours .	pada jam sibuk kemacetan memperlambat kedatangan saya selama dua jam .
your lips are blue .	bibirmu biru .
neither tom nor mary has one of those .	tom maupun mary tidak memiliki itu .
if there s a cheap kanji dictionary in japan , i will buy it .	jika ada kamus kanji yang murah di jepang , aku akan membelinya .
tom ate only one slice of bread .	tom hanya memakan sepotong roti .
do you like italian food ?	apakah kamu suka makanan italia ?
do you like juice ?	apakah kamu suka jus ?
air is to man what water is to fish .	udara bagi manusia layaknya air bagi ikan .
i started writing a book .	aku mulai menulis buku .
they were waiting for tom .	mereka sedang menunggu tom .
do you have a driver s license ?	apa kau memiliki sim ?
you can keep the change .	kau bisa menyimpan kembaliannya .
grab your gear .	ambil perlengkapanmu .
tom likes mary . i think that s obvious to everyone .	tom suka pada mary . aku pikir itu sudah jelas bagi semuanya .
tom looks different .	tom terlihat berbeda .
this room is very warm .	ruangan ini sangat hangat .
leave me in peace !	tinggalkan aku sendiri !
i didn t see anything .	aku tidak melihat apa apa .
tom ate a bowl of strawberries .	tom makan semangkuk stroberi .
i really like swimming .	aku sangat suka berenang .
we re sociable .	kami mudah bergaul .
i want coffee , toast , and jelly .	aku mau kopi , roti panggang , dan jeli .
tomorrow is her birthday .	besok dia berulang tahun .
thanks very much .	terima kasih banyak .
tom doesn t like beer or wine .	tom tidak suka bir ataupun anggur .
my favorite color is red .	warna kesukaanku adalah merah .
the desk drawer is open .	laci mejanya terbuka .
can you play the piano ?	bisakah kau bermain piano ?
i need his help .	aku membutuhkan bantuannya .
tom painted the table .	tom mengecat meja itu .
i hope we can fix that .	aku harap kita bisa memperbaiki itu .
tom seems a little dangerous .	tom terlihat sedikit berbahaya .
it s not enough .	itu tidak cukup .
he took a deep breath before entering his boss s office .	dia menarik napas panjang sebelum memasuki kantor bosnya .
you may choose whichever book you like .	kamu boleh pilih buku mana saja yang kamu suka .
this area is rich in marine products .	daerah ini kaya akan hasil laut .
tom won t like that answer .	tom tidak akan menyukai jawaban itu .
do you believe everything tom tells you ?	apakah kamu percaya apa pun yang tom katakan padamu ?
the tv was on all night .	televisi menyala sepanjang malam .
tom can cook .	tom bisa memasak .
please show me the wound .	tolong tunjukkan saya lukanya .
i had no one to turn to .	tidak ada seorang pun yang bisa kutemui .
tom probably has better things to do with his time than sit in meetings all day .	tom kemungkinan memiliki urusan yang lebih penting ketimbang duduk di ruang rapat selama seharian .
i feel really relieved .	aku merasa sangat lega .
this is a car imported from germany .	ini adalah mobil yang diimpor dari jerman .
let s go back to the office .	mari kembali ke kantor .
tom was surprised mary had a motorcycle .	tom terkejut mengetahui mary memiliki sepeda motor .
we can go after lunch .	kita bisa pergi setelah makan siang .
he turned on the radio .	dia menyalakan radio itu .
i appreciate you .	aku menghargaimu .
i have to call my father .	aku harus menghubungi ayahku .
i like noodles .	aku suka mi .
what do you think is the most dangerous animal ?	menurutmu , binatang apakah yang paling berbahaya ?
tom is a convicted felon .	tom adalah penjahat terhukum .
i m glad to see you again .	senang bertemu denganmu lagi .
nobody can see it .	tidak ada yang bisa melihatnya .
i ve never swum in the pacific before .	aku belum pernah berenang di samudra pasifik sebelumnya .
don t work too hard !	jangan bekerja terlalu keras !
i ll wait here .	aku akan menunggu di sini .
the train flipped over .	kereta tersebut terguling .
the king lives in the castle .	sang raja tinggal di istana .
many philosophers come from greece .	banyak filsuf berasal dari yunani .
i m reading .	saya sedang membaca .
i like to listen to the radio .	aku suka mendengarkan radio .
i admit i was surprised .	kuakui aku terkejut .
i ate three pieces of cake .	saya memakan tiga potong kue .
i ve got a fever .	saya demam .
did tom say anything to you about that ?	apakah tom mengatakan sesuatu kepadamu tentang hal itu ?
you were too young .	kamu itu masih bau kencur .
how do i eat this ?	bagaimana caranya makan ini ?
compass needles point to the north .	jarum kompas menunjuk ke utara .
tom folded the folding chair .	tom melipat kursi lipat itu .
tom tried to remember the doctor s name , but he couldn t .	tom berusaha mengingat nama dokter itu , tetapi tidak bisa .
don t spit .	jangan meludah .
don t be like everyone else .	jangan jadi seperti yang lain .
that door is locked .	pintu itu terkunci .
when is a good time for you ?	kamu bisanya kapan ?
what are you worried about ?	apa yang sedang kamu khawatirkan ?
many men grow beards because they re too lazy to shave .	banyak pria menumbuhkan janggut hanya karena mereka malas bercukur .
are you cold ?	kamu kedinginan ?
i will gladly help you .	saya dengan senang hati akan membantu anda .
he s your son .	dia anak laki lakimu .
we ll fix it .	kami akan memperbaikinya .
i ve just finished eating .	aku baru saja selesai makan .
in that respect , i agree with you completely .	dalam hal itu , saya sepenuhnya setuju dengan anda .
i can t say that .	aku tidak bisa mengatakan itu .
mary decided never to see him any more .	mary memutuskan untuk tidak akan menemuinya lagi .
i frequently think about my mother who passed away .	aku sering kali memikirkan ibuku yang telah meninggal .
i will take both this one and that one .	aku akan mengambil baik yang ini dan yang itu .
do it your own way if you don t like my way .	lakukan caramu sendiri kalau kamu tidak menyukai caraku .
my heart is weak .	jantungku lemah .
i forget his name .	saya lupa namanya .
i hope the conflict will be resolved peacefully .	aku harap konfliknya diselesaikan dengan damai .
you ve dropped your pen .	kau telah menjatuhkan penamu .
i can t read tom s handwriting .	aku tidak bisa membaca tulisan tangan tom .
i have my own bedroom at home .	aku punya kamar tidurku sendiri di rumah .
tom certainly is skinny .	tom tentunya kurus .
i don t believe you .	aku tidak percaya padamu .
tom is not in his bedroom .	tom tidak sedang berada di kamarnya .
i was caught in the rain .	aku kehujanan .
somebody has stolen my hair dryer .	seseorang telah mencuri pengering rambutku .
tom isn t your boyfriend , is he ?	tom bukan pacarmu , kan ?
what s your favorite constellation ?	apa rasi bintang favoritmu ?
come back as soon as possible .	kembalilah sesegera mungkin .
they are playing chess .	mereka sedang bermain catur .
please take a look at that picture .	tolong lihat gambar itu .
yesterday was hotter .	kemarin lebih panas .
no one is to leave without permission .	tidak ada yang boleh keluar tanpa izin .
tom will go there tomorrow .	tom akan pergi ke sana besok .
your friends are late .	teman temanmu terlambat .
this year is a leap year .	tahun ini tahun kabisat .
why don t you learn french ?	mengapa kamu tidak belajar bahasa prancis ?
tom said he didn t know mary couldn t swim .	tom bilang dia tidak tahu kalau mary tidak bisa berenang .
i m a star .	aku seorang bintang .
tom wants to play chess with mary .	tom ingin bermain catur dengan mary .
i can t believe i m doing this again .	aku tidak percaya aku melakukan ini lagi .
i m going to do what i believe is right .	aku akan melakukan apa yang aku yakini itu benar .
since it was raining , i stayed home .	karena sedang turun hujan , aku tidak keluar dari rumah .
you can dance , can t you ?	kamu bisa menari , kan ?
that needs to be investigated .	itu perlu diinvestigasi .
tom wasn t the best student in our class .	tom bukan siswa terbaik di kelas kami .
let s let tom do it .	mari kita biarkan tom yang melakukannya .
tom was bald .	tom botak .
tom is at home now .	tom sedang di rumah sekarang .
turn on cnn .	nyalakan cnn .
are you living a double life ?	apakah kamu menjalani kehidupan ganda ?
tom pulled the door closed and locked it .	tom menarik pintu hingga tertutup dan menguncinya .
stop talking about tom .	berhenti berbicara tentang tom .
they kissed again .	mereka berciuman lagi .
i m on a diet .	aku sedang melakukan diet .
don t let me down .	jangan mengecewakanku .
we enjoyed watching tv .	kami menikmati menonton tv .
we were all present at the meeting .	kami semua hadir pada pertemuan itu .
i can t fly .	saya tidak bisa terbang .
he made an important scientific discovery .	dia membuat penemuan ilmiah penting .
i want you to be quiet .	saya ingin anda diam .
the car left a cloud of dust behind it .	mobil itu mengeluarkan asap tebal .
the wine was excellent .	minuman anggur itu rasanya luar biasa .
i saw it in a magazine .	aku melihatnya pada sebuah majalah .
how old is your wife ?	berapa usia istri anda ?
you d better not go .	sebaiknya kamu tidak pergi .
what did you talk about ?	kamu membicarakan tentang apa ?
i told you the concert was going to be boring . why didn t you believe me ?	saya sudah katakan bahwa konsernya akan membosankan . kenapa kamu tidak mempercayai saya ?
since he was very drunk , he couldn t drive his car home .	karena ia sangat mabuk , ia tidak bisa mengemudikan mobilnya menuju rumahnya .
the bus was late because of the traffic jam .	busnya terlambat karena lalu lintas yang macet .
tom may not be busy , but mary is .	tom mungkin tidak sibuk , tetapi mary mungkin .
i don t mind waiting .	aku tidak keberatan menunggu .
can you see it ?	kamu masih belum memahaminya ?
they opened the door .	mereka membuka pintu .
englishmen are , on the whole , conservative .	orang inggris pada umumnya konservatif .
thanks a bunch .	terima kasih banyak .
if i had been rich , i would have given you some money .	jika saya kaya , saya akan memberimu uang .
has tom gone ?	sudahkah tom pergi ?
let sleeping dogs lie .	anak badak jangan dihambat hambat .
tom finally met mary .	tom akhirnya bertemu dengan mary .
i love mexican food .	aku suka masakan meksiko .
if you re happy , i m happy .	jika kamu senang , aku ikut senang .
what s your mother s name ?	siapa nama ibumu ?
not even one taxi stopped .	tidak ada satupun taksi yang berhenti .
i get the point .	aku paham maksudnya .
he used to eat out every day , but now he can t afford it .	dia biasanya makan di luar setiap hari , tapi sekarang dia tidak bisa .
who is the oldest person in the world ?	siapakah orang tertua di dunia ?
do you study every day ?	apa kamu belajar setiap hari ?
i don t like exercising .	saya tidak suka berolahraga .
that s what i told them .	itulah yang aku katakan pada mereka .
all of you have to read it .	kalian semua harus membacanya .
she came to japan to study japanese .	dia datang ke jepang untuk belajar bahasa jepang .
tom donned his party hat .	tom mengenakan topi pestanya .
i ve lost my ticket .	aku menghilangkan tiketku .
carrots can be eaten raw or cooked .	wortel bisa dimakan mentah atau dimasak .
tom borrowed a book from the library .	tom meminjam buku dari perpustakaan .
tom liked it .	tom menyukainya .
the dog is theirs .	anjing itu milik mereka .
tom is taller than me .	tom lebih tinggi daripada aku .
i believe in ghosts .	aku percaya akan adanya hantu .
you re stupid !	kamu bodoh !
it s not going to be a problem , is it ?	hal ini tidak akan menjadi masalah , bukan ?
i m glad tom enjoyed it .	saya senang tom menyukainya .
in japan , we drive on the left side of the road .	di jepang kami menyetir kendaraan pada sisi kiri jalan .
look before you leap .	telah dijual , maka dibeli .
tom lied .	tom berbohong .
what made you so angry ?	apa yang membuatmu begitu marah ?
hand me that mike .	berikan miknya padaku .
cows are sacred animals in india .	sapi adalah hewan suci di india .
let s stop and take a rest .	mari berhenti dan beristirahat .
i m going to europe next week .	aku akan pergi ke eropa minggu depan
please explain it to me again .	tolong jelaskan kembali padaku .
i m hungry !	aku lapar !
if tom was angry before , he ll be furious now .	jika sebelumnya tom marah , dia akan menjadi sangat marah sekarang ini .
you re a good cook .	kamu koki yang terampil .
they went to the beach .	mereka pergi ke pantai .
who does your laundry for you ?	siapa yang mencucikan bajumu ?
he got bored quickly .	dia mudah bosan .
let s start working .	mari kita mulai bekerja .
tom has never had much money .	tom tidak pernah punya banyak uang .
let s start .	mari kita mulai .
this orange is delicious .	jeruk ini enak .
whose bicycle is this ?	sepeda ini milik siapa ?
is this water drinkable ?	apa air ini bisa diminum ?
i m a lousy swimmer .	aku perenang yang payah .
where s the rope ?	di mana talinya ?
why doesn t anyone want to be friends with me ?	mengapa tidak ada yang mau berteman denganku ?
tom scanned the qr code with his phone .	tom memindai kode qr itu dengan ponselnya .
did you leave a tip ?	apa kau meninggalkan tip ?
we climbed mt . fuji last summer .	kami mendaki gunung fuji musim panas tahun lalu .
i am not a student .	aku bukan pelajar .
that s why i lied .	oleh sebab itulah aku berbohong .
i love the taste of watermelon .	aku sangat suka rasanya semangka .
in japan , the new school year begins in april .	di jepang , tahun ajaran baru dimulai pada bulan april .
earth is a beautiful planet .	bumi adalah planet yang indah .
what time did you arrive there ?	anda tiba di sana pada pukul berapa ?
she s stubborn .	dia keras kepala .
i want what you want .	aku mau yang kamu mau .
are your weapons ready ?	apakah senjata kalian siap ?
leave me .	tinggalkan aku .
this is all i have .	ini semua yang saya punya .
democracy originated in ancient greece .	demokrasi berasal dari yunani kuno .
milk is white .	susu berwarna putih .
this is probably for you .	ini mungkin untukmu .
he dates the custom from the colonial days .	dia memperkirakan bahwa adat kebiasaan itu telah dimulai sejak jaman kolonial .
i like to eat watermelon .	aku suka makan semangka .
do you know who the british ambassador to japan is ?	apakah kamu tahu siapa duta besar inggris untuk jepang ?
my wife died three years ago .	istri saya meninggal tiga tahun yang lalu .
i m tired of it .	aku lelah dengan hal itu .
this isn t exactly what i wanted .	ini tidak seperti yang aku inginkan .
what are they drinking ?	apa yang mereka minum ?
