the boy said that the taxi vanished into the fog .	anak itu bilang bahwa taksi tersebut telah lenyap di dalam kabut .
tom is only three years older than john .	tom hanya lebih tua tiga tahun dari john .
i like white roses better than red ones .	aku lebih suka mawar putih daripada mawar merah .
i need information .	aku butuh informasi .
i wondered when you d get here .	saya penasaran kamu kapan sampai sini .
i am dying to see her again .	aku benar benar rindu untuk bertemu dengannya lagi .
i love arguing with tom .	aku senang bertengkar dengan tom .
i have a red bike .	aku punya sepeda merah .
tom is in love with another woman .	tom sedang jatuh cinta dengan wanita lain .
what s your favorite kind of art ?	jenis seni apa yang menjadi favorit anda ?
it s my duty .	ini kewajiban saya .
i thought a cup of coffee might make you feel better .	secangkir kopi akan membuatmu merasa lebih baik .
you know this is nonsense .	kamu tahu ini tidak masuk akal .
tom will answer that question .	tom akan menjawab pertanyaan itu .
i want to sell my car .	saya ingin menjual mobil saya .
i can t buy anything because i don t have any money .	aku tidak bisa membeli apa apa karena aku tidak punya uang .
i fainted .	aku pingsan .
that university was my first choice .	universitas itu adalah pilihanku yang pertama .
i ll be in australia in october .	bulan oktober ini aku akan ada di australia .
i ve read both books .	aku sudah membaca kedua buku itu .
some people never grow up .	beberapa orang tidak pernah menjadi dewasa .
do you know what happened ?	apa kau tahu apa yang sedang terjadi ?
i m really hungry .	aku sangat lapar .
did tom really want mary to dance with him ?	apakah tom benar benar menginginkan mary untuk berdansa dengan dirinya ?
that s a tower .	itu menara .
the early bird catches the worm .	siapa cepat dia dapat .
my father told me about his experiences during the war .	ayah menceritakan padaku pengalaman pengalamannya selama masa perang .
i want to study abroad .	saya ingin belajar di luar negeri .
french is their mother tongue .	bahasa prancis adalah bahasa ibu mereka .
no one has been here .	tidak ada yang pernah ke sini .
you can t have dessert until you finish your meal .	kamu tidak boleh makan pencuci mulut sampai kamu menghabiskan makananmu .
we won t go back there again .	kami tidak akan kembali ke sana lagi .
i ll help , too .	saya akan bantu juga .
my family is a large one .	keluargaku adalah keluarga yang besar .
we re confused .	kami bingung .
you have to be patient .	kau harus bersabar .
thank you for listening to me .	terima kasih sudah mendengarkanku .
he s collecting various data .	dia mengumpulkan berbagai data .
tom is trying not to cry .	tom mencoba untuk tidak menangis .
is this fish still alive ?	apakah ikan ini masih hidup ?
are we your enemies ?	apakah kami musuh kalian ?
i want to be a good father .	aku ingin menjadi ayah yang baik .
tom knits .	tom merajut .
how many minutes are there in a day ?	ada berapa menit dalam sehari ?
they speak english in new zealand .	mereka berbicara dalam bahasa inggris di selandia baru .
i gave each boy an apple .	aku memberi masing masing anak sebuah apel .
call me at the office .	hubungi aku melalui kantor .
i m trying to save money .	aku mencoba menghemat uang .
i have no idea what i m talking about .	aku tidak tahu apa yang aku bicarakan .
it won t come up .	itu tidak akan muncul .
tom has a better plan .	tom punya rencana yang lebih bagus .
she wants to kiss him .	dia ingin menciumnya .
who is taller , tom or mary ?	siapa yang lebih tinggi , tom atau mary ?
i just clipped my nails .	aku baru saja memotong kukuku .
my grandmother is still vigorous at 82 years old .	nenekku masih semangat kuta di usianya yang 82 tahun .
we hope you can help us .	kami harap kamu bisa menolong kami .
tom took a folded piece of paper out of his pocket and put it on the table in front of mary .	tom mengeluarkan selembar kertas yang terlipat dari kantongnya dan meletakkannya di atas meja di depan mary .
i m in love with the girl next door .	aku jatuh cinta dengan gadis sebelah .
tom passed out .	tom pingsan .
tom did not answer .	tom tidak menjawab .
are you guys hungry ?	apa kalian lapar ?
could you give me a few more minutes ?	bisakah saya minta beberapa menit lagi ?
she and i are about the same height .	tinggi badanku dan dia hampir sama .
he took a chance investing his money in the new company .	dia mencoba berinvestasi di perusahaan baru tersebut .
is this computer connected to the internet ?	apa komputer ini terhubung pada internet ?
tom knows he s in trouble .	tom tahu dia dalam masalah .
you can t let that happen .	kau tidak boleh membiarkannya terjadi .
i borrow money .	saya meminjam uang .
give me three pieces of chalk .	berikan aku tiga buah kapur .
tom is a university student .	tom adalah mahasiswa .
i want to go with you .	saya ingin pergi dengan anda .
forget the past , think about the future , and live in the present .	lupakan masa lalu , pikirkan masa depan , dan hidupilah masa sekarang !
i gave tom a hug .	aku memeluk tom .
i didn t see the fire hydrant .	aku tidak melihat hidrannya .
pizza is my favorite food .	piza adalah makanan kesukaanku .
tom and mary are still alive .	tom dan mary masih hidup .
he once knew her , but they are no longer friends .	dia pernah mengenalnya , tetapi mereka tidak lagi berteman .
there were many cars .	ada banyak mobil .
i don t like it , either .	aku juga tidak menyukainya .
i can t do my job without a computer .	aku tidak bisa mengerjakan pekerjaanku tanpa komputer .
there isn t a single tree here .	tidak ada satu pun pohon di sini .
tom sometimes comes home late .	tom kadang kadang telat pulang ke rumah .
is this a picture that you yourself drew ?	apakah ini gambar yang kamu buat sendiri ?
he gave us not only clothes but some money .	dia tidak hanya memberi kami pakaian , tetapi juga uang .
where are your boots ?	di mana sepatu botmu ?
why not have dinner with us ?	kenapa tidak makan malam bersama kami ?
you look quite sick .	kamu kelihatan agak sakit .
kublai khan established the yuan dynasty in 1271 .	kubilai khan mendirikan dinasti yuan pada tahun 1271 .
one of my earrings is missing .	salah satu anting anting saya hilang .
you look familiar . do i know you ?	anda seperti kenalan saya . apakah saya mengenal anda ?
she speaks relatively fast .	dia bicara relatif cepat .
you re the only one who can help me .	kamulah satu satunya yang dapat membantuku .
the car hit a tree .	mobil itu menabrak pohon .
which one is tom s ?	punya tom yang mana ?
we just met tom .	kami baru saja bertemu tom .
there was a problem at school .	tadi ada masalah di sekolah .
tom s hands are large .	tangan tom besar .
there is one apple on the desk .	ada satu buah apel di atas meja .
who s your teacher ?	siapa gurumu ?
it s past eight .	sekarang jam delapan lebih .
he hates spiders .	dia benci laba laba .
when will you leave ?	kamu kapan akan pergi ?
tom is still crying .	tom masih menangis .
i tried to help her , but there was no way i could .	aku mencoba untuk menolongnya , tetapi tidak ada cara bagiku untuk bisa menolongnya .
is there a gas station around here ?	apakah ada pom bensin di sekitar sini ?
is it true you can speak french ?	benar kamu bisa bahasa prancis ?
where did it go ?	ke mana perginya ?
we ve been trying .	kami mencoba .
i am only joking .	aku cuma bercanda .
why do you need this ?	kenapa kau membutuhkan ini ?
the new bridge is under construction .	jembatan baru sedang dibangun .
it turned out to be true .	ternyata itu memang benar .
how do you eat this ?	bagaimana caranya makan ini ?
tom left his trumpet at school .	tom meninggalkan trompetnya di sekolah .
i m a man .	aku laki laki .
tell your mother about the trip .	beritahukan ibumu soal perjalanan itu .
do you have any allergies ?	apa anda punya alergi ?
this desk is too small for tom .	meja ini terlalu kecil untuk tom .
he hit his head against a rock .	dia membenturkan kepalanya ke sebuah batu .
i m very happy .	saya sangat senang .
are you sleeping ?	kamu lagi tidur ?
tom vomited .	tom muntah .
this list isn t official .	daftar ini tidak resmi .
kick the ball .	tendang bolanya .
are we your enemies ?	apakah kami musuhmu ?
we maintain our independence .	kami mempertahankan kemerdekaan kami .
i can t raise my right arm .	aku tidak bisa menaikkan lengan kananku .
we sat there .	kami duduk di sana .
nobody called .	tidak ada yang menelepon .
he declared that they had been friends for 30 years .	dia menyatakan bahwa mereka telah berteman selama 30 tahun .
tom says he can wait a long time .	tom berkata dia dapat menunggu lama .
his letter says he ll arrive next sunday .	di suratnya tertulis kalau dia akan tiba hari minggu besok .
my hobby is writing stories .	hobiku menulis cerita .
could you press this button ?	bisakah anda menekan tombol ini ?
the day will soon come when man can travel to mars .	akan segera tiba hari ketika manusia bisa pergi ke mars .
when in rome , do as the romans .	di mana bumi dipijak , di situ langit dijunjung .
tom barfed .	tom muntah .
you must be careful not to make him angry .	kamu harus hati hati jangan membuatnya marah .
my daughter likes to play with dolls .	anak perempuan saya gemar bermain boneka .
it s not a good idea .	ini bukan ide yang bagus .
i guess that s possible .	aku rasa itu mungkin .
tom got off his bicycle .	tom turun dari sepedanya .
thank you for the book .	terima kasih atas bukunya .
the water was blue .	airnya berwarna biru .
my shoes are wet .	sepatuku basah .
he did not expect to live so long .	dia tidak berharap untuk hidup begitu lama .
can we interview tom ?	bisakah kami mewawancarai tom ?
i thought we d never get out of the burning building alive .	kukira kita tidak akan pernah keluar dari bangunan yang terbakar itu hidup hidup .
we re sure .	kami yakin .
how can you bear such a humiliation ?	bagaimana kamu bisa tahan dengan penghinaan itu ?
tom didn t realize what was happening .	tom tidak menyadari apa yang sedang terjadi tadi .
i haven t received anything yet .	saya belum menerima apa pun .
i m not going back .	aku tidak akan kembali .
everything s so cheap .	semuanya sangat murah .
i left my wallet at home .	dompet saya tertinggal di rumah .
few people visit me these days .	akhir akhir ini , sedikit orang mengunjungiku .
i m counting on you .	aku mengandalkanmu .
rice prices are regulated by the government .	harga beras diatur oleh pemerintah .
he is very handsome .	dia sangat tampan .
smell this .	cium ini .
had they left a little earlier , they would have avoided the traffic jam .	kalau mereka meninggalkan lebih awal , mereka akan dapat menghindari kemacetan .
tom noticed a pattern in the data .	tom melihat suatu pola di dalam data tersebut .
do you bowl ?	apa kau bermain boling ?
i want him in my office .	saya ingin dia ada di kantorku .
i d like to stick around a little longer to see what happens .	aku akan di sini sebentar untuk melihat apa yang terjadi .
it s tom s birthday today .	hari ini ulang tahun tom .
tom works as a security guard in a jewelry store .	tom bekerja sebagai satpam di toko perhiasan .
where are you headed ?	kamu menuju ke mana ?
remember to answer his letter .	jangan lupa membalas suratnya .
i d like to know the reason .	saya ingin tahu alasannya
the sun doesn t shine at night .	matahari tidak bersinar di malam hari .
tomorrow is october 20th .	besok tanggal 20 oktober .
i would like to have a cup of coffee .	aku ingin minum kopi .
cats can see even in dark places .	kucing bisa melihat meskipun di tempat gelap .
learning foreign languages is boring .	belajar bahasa asing membosankan .
that s a difficult thing to do .	itu hal yang sulit dilakukan .
tom wet the bed .	tom mengompol .
are you sure that s enough ?	kamu yakin itu cukup ?
tom is not too pleased .	tom tidak terlalu senang .
get lost !	pergi sana !
i still haven t heard from him .	aku masih belum menerima kabar darinya .
what time do you get up ?	anda bangun pada pukul berapa ?
i ll be at home .	aku akan di rumah .
don t follow me . i m lost , too .	jangan ikuti aku . aku juga tersesat .
tom went to boston to see mary .	tom pergi ke boston untuk menemui mary .
we planted rice .	kami menanam padi .
the sky is blue .	langit berwarna biru .
each box has about thirty oranges .	setiap kotak berisi sekitar tiga puluh jeruk .
tom looks a bit sick .	tom terlihat agak sakit .
tom is drooling .	tom mengiler .
who s your favorite character on glee ?	siapa karakter favoritmu di glee ?
i hope i survive .	aku harap aku akan bertahan hidup .
what is tom afraid of ?	apa yang tom takutkan ?
this is imported paper .	ini kertas impor .
tom showed up at john and mary s wedding .	tom hadir pada pernikahan john dan mary .
tom lied to protect his family .	tom berbohong untuk melindungi keluarganya .
tom is the one who shot mary .	tom lah yang menembak mary .
we ve known each other for ages .	sudah lama kami saling kenal .
i study math as hard as english .	aku belajar matematika dengan giat , segiat waktu aku belajar bahasa inggris .
tom s fat .	tom gemuk .
tom is a perfectionist .	tom seorang perfeksionis .
i ll go to a museum today .	aku akan pergi ke sebuah museum hari ini .
write your name and address on this envelope .	tuliskan nama dan alamat anda pada amplop ini .
how much do you charge by the hour ?	berapa besar anda mematok biaya per jamnya ?
i m allergic to cat hair .	aku alergi rambut kucing .
tom is fasting .	tom sedang berpuasa .
please hand me a sheet of paper .	tolong berikan saya selembar kertas .
you can rely on him .	kau bisa mengandalkannya .
look at tom .	lihatlah ke arah tom .
i m expecting .	saya sedang hamil .
he delivers newspapers .	dia mengantar koran .
the student left without saying anything .	murid itu pergi tanpa berkata sesuatu .
i tried to write with my left hand .	saya mencoba untuk menulisnya dengan tangan kiri .
let s do this now .	mari kita melakukannya sekarang .
that s a new house .	itu rumah baru .
i don t think i understand .	sepertinya aku tidak paham .
i was kind of nervous .	aku agak gugup .
both his parents are dead .	kedua orang tuanya sudah meninggal .
they used to love jokes .	dulu mereka suka bercanda .
they changed it very recently .	mereka menggantinya baru baru ini .
we don t want it .	kami tidak mau itu .
this shouldn t be hard .	ini seharusnya mudah .
don t bite off more than you can chew .	kalau kail panjang sejengkal , jangan laut hendak diduga .
what do you guys have ?	kalian punya apa ?
he s not my boyfriend . he s my brother .	dia bukan pacarku , dia kakakku .
i never wanted to compete with you .	aku tidak pernah ingin bersaing denganmu .
one of the students didn t come today .	salah seorang murid tidak datang hari ini .
he shot at me .	dia menembak ke arahku .
the test result is negative .	hasil tesnya negatif .
the drug smuggler was arrested at the airport .	penyelundup narkoba itu ditangkap di bandara .
you mustn t tell anyone .	kamu tidak boleh memberitahukannya pada siapapun .
that s not my concern .	itu bukan urusanku .
you were at home yesterday , weren t you ?	kau kemarin berada di rumah , kan ?
all of us went except for him .	kami semua pergi kecuali dia .
tom didn t want to make the same mistake as mary .	tom tidak ingin membuat kesalahan yang sama seperti mary .
tom hid himself under the table .	tom menyembunyikan dirinya di bawah meja .
they eat chocolate .	mereka makan cokelat .
could you please show me your passport ?	bisa tolong tunjukkan paspor anda kepada saya ?
the computer is broken .	komputernya rusak .
tom has passed out .	tom pingsan .
you are responsible for the death of the child .	anda bertanggung jawab atas kematian anak itu .
who painted this painting ?	siapa yang melukis lukisan ini ?
i ll tell you what you want to know .	aku akan memberitahumu apa yang ingin kau ketahui .
tom is very choosy .	tom sangat pilih pilih .
how many times have you been to boston ?	sudah berapa kali kamu ke boston ?
where were you ?	tadi kamu di mana ?
i didn t know what made my leg swell up like that .	aku tidak tahu apa yang membuat kakiku bengkak seperti itu .
we realize now that tom knew exactly who mary was .	kami akhirnya menyadari bahwa tom telah mengetahui siapa mary sebenarnya .
i can t find the keys to my house .	aku tidak menemukan kunci rumahku .
you have a gift for music .	kamu punya bakat di bidang musik .
i have toothache .	saya sakit gigi .
the museum is open from monday to friday .	museum ini buka dari senin hingga jumat .
if it rains , i ll stay at home .	jika hujan , aku akan tinggal di rumah .
that s very easy to do .	itu sangat mudah dilakukan .
tom s quite good .	tom lumayan bagus .
i think i m pregnant .	aku rasa aku hamil .
he is handsome .	dia tampan .
i want to tell you something .	aku ingin memberi tahu kalian sesuatu .
mount everest is the tallest mountain in the world .	gunung everest adalah gunung paling tinggi di dunia .
i think ghosts exist .	aku pikir hantu itu ada .
my feet hurt .	kakiku sakit .
i didn t actually do anything .	aku sebenarnya tidak melakukan apa apa .
the debate is continuing .	debatnya berlanjut .
it could work .	itu bisa berhasil .
we all got a christmas bonus .	kami semua mendapat thr natal .
what s up ?	ada apa ?
i ve never climbed mt . fuji .	aku belum pernah mendaki gunung fuji .
please sum up your idea .	tolong rangkum ide anda .
i m proud of you .	aku bangga padamu .
they live in a house .	mereka tinggal di sebuah rumah .
fortunately he didn t die in the accident .	untungnya dia tidak tewas dalam kecelakaan itu .
i don t think you understand .	aku pikir kamu tidak mengerti .
tom was sentenced to death .	tom dijatuhi hukuman mati .
which do you like better , summer or winter ?	kamu lebih suka musim panas atau musim dingin ?
i m sorry , but i don t understand .	maaf , tetapi saya tidak mengerti .
god created the world in six days .	tuhan menciptakan dunia dalam waktu enam hari .
are you still here ?	apakah kamu masih di sini ?
i wanted to go there .	aku ingin pergi ke sana .
i think tom might leave on october 20th .	menurutku tom mungkin akan pergi pada 20 oktober .
tom is a bachelor .	tom adalah seorang bujangan .
is your house new ?	rumahmu baru ?
i ll ask later .	aku akan tanya nanti .
the author is my friend .	penulisnya adalah temanku .
she looks happy .	dia terlihat bahagia .
do you have a vacancy ?	apa ada kamar yang kosong ?
she does not like sushi .	dia tidak suka susyi .
tom listened to mary patiently .	tom mendengarkan mary dengan sabar .
you ve got a lot of guts .	kamu berani sekali .
they can t stop us .	mereka tidak bisa menghentikan kami .
what does this mean ?	apa artinya ini ?
the kitten was drinking milk under the table .	anak kucing itu tadi sedang minum susu di bawah meja .
have you read the report ?	sudahkah kamu membaca laporan itu ?
tom looks perplexed .	tom terlihat kebingungan .
have you already started learning french ?	apa kau sudah mulai mempelajari bahasa prancis ?
tom has been kicked off the team .	tom telah dikeluarkan dari tim .
tom was in seventh heaven .	tom sudah ada di langit ketujuh
tom doesn t want to wait .	tom tidak ingin menunggu .
that s the one thing i hadn t thought of .	itu adalah satu hal yang belum aku pikirkan .
that s life .	begitulah hidup .
tom was eating .	tom sedang makan tadi .
finish it for tom .	selesaikan untuk tom .
we re lucky , aren t we ?	kita beruntung , kan ?
in my city , there is no school for learning esperanto .	di kota saya tidak ada sekolah untuk belajar bahasa esperanto .
we never work on sunday .	kami tidak pernah bekerja di hari minggu .
tom doesn t like the idea .	tom tidak menyukai ide tersebut .
tom is quick tempered , isn t he ?	tom gampang marah , ya ?
how old are you ? i m 16 years old .	berapa umurmu ? aku 16 tahun .
tom s not home .	tom tidak ada di rumah .
many famous people are behind the movement .	banyak orang terkenal berada di balik pergerakan itu .
i m telling you the truth .	aku mengatakan padamu yang sebenarnya .
who said that ?	siapa yang mengatakan itu ?
could you turn that down , please ?	bisa tolong dikecilkan ?
i hope that i can do it .	aku harap aku bisa melakukannya .
when did the accident happen ?	kapan kecelakaan itu terjadi ?
i ll make you a new suit .	aku akan membuatkanmu pakaian baru .
i m an accountant .	aku seorang akuntan .
tom tried to convince mary that the plan wouldn t work .	tom mencoba meyakinkan mary bahwa rencana itu tidak akan berhasil .
tom looks dumbfounded .	tom tampak tercengang .
i had to work on an essay .	tadi aku harus mengerjakan esaiku .
there are plenty more fish in the sea .	bunga bukan sekuntum , kumbang bukan seekor .
where have you gone ?	ke mana kamu pergi ?
thank you for your help .	terima kasih atas bantuannya .
i don t think i ll be able to pass the test .	sepertinya saya tidak akan bisa lulus tes .
why are you always so impatient ?	kenapa kamu selalu tidak sabar ?
where are you going ?	anda akan pergi ke mana ?
do you feel guilty ?	apa anda merasa bersalah ?
when will you visit me again ?	kapan kau akan mengunjungiku lagi ?
our plane landed in boston just before the storm hit .	pesawat kami mendarat di boston tepat sebelum badai menghantam .
i can t go there .	saya tidak bisa pergi ke sana .
tom doesn t need to go there by himself .	tom tidak perlu pergi ke sana sendirian .
i like this one , too .	aku juga suka yang ini .
he may have told a lie .	dia bisa saja berbohong .
i m looking for another job .	saya sedang mencari pekerjaan yang lain .
we re out of sugar .	kita kehabisan gula .
the police can t find tom .	polisi tidak berhasil menemukan tom .
we won the battle .	kami memenangkan pertempuran itu .
tom is mary s best friend .	tom adalah teman baik mary .
have you eaten dinner ?	kamu sudah makan malam ?
i hear you re very good at french .	kudengar kamu sangat pandai berbahasa prancis .
are you certain ?	apa kau yakin ?
there were few people in the park .	hanya ada sedikit orang di taman .
tom blew his top when he heard that mary had gone out with john .	tom menjadi emosi ketika ia mendengar kalau mary pergi keluar dengan john .
close the door , please .	tolong tutup pintunya .
my parents always speak to me in french .	orang tuaku selalu berbicara kepadaku dalam bahasa prancis .
i didn t come here by car today .	hari ini saya tidak mengendarai mobil ke sini .
just go for it .	lakukan saja .
you just made my day .	kau baru saja membuatku merasa sangat bahagia .
i owe you 3 , 000 yen .	aku berutang 3 . 000 yen padamu .
i said that as a joke .	itu tadi bercanda .
i arrived there too early .	aku tiba di sana terlalu awal .
i just have to get out of here .	aku hanya harus keluar dari sini .
if tom would smile more often , he d probably have more friends .	jika tom lebih sering tersenyum , dia mungkin akan memiliki lebih banyak teman .
you re still very young .	kamu masih sangat muda .
i wake up every morning before dawn .	aku bangun setiap pagi sebelum subuh .
culture destroys language .	budaya menghancurkan bahasa .
there will be a lunar eclipse tomorrow .	akan ada gerhana bulan besok .
stop following me .	berhenti mengikutiku .
i have two cousins .	aku punya dua sepupu .
i don t know .	aku tidak tahu .
i m a fisherman .	aku nelayan .
he has a good brain .	dia punya otak yang cerdas .
what languages are spoken in canada ?	bahasa apa saja yang digunakan di kanada ?
i bought a camera for 30 dollars .	saya membeli kamera seharga 30 dolar .
i don t want to live with you .	aku tidak ingin hidup denganmu .
i had to decline the invitation because i was sick .	saya harus menolak undangan itu karena saya sakit .
tom turned off the radio .	tom mematikan radio itu .
tom works too much .	tom terlalu banyak bekerja .
i heard her speaking english as fluently as an american .	saya mendengarnya berbicara dengan bahasa inggris dengan lancar seperti orang amerika .
tom is a red sox fan .	tom adalah penggemar dari red sox .
have you ever been to america ?	pernahkah kamu ke amerika ?
she has long arms and legs .	dia memiliki lengan dan kaki yang panjang .
i will miss you all .	aku akan merindukan kalian semua .
tom is wearing a biohazard suit .	tom mengenakan baju biobahaya .
he has no wife , no children and no friends .	dia tidak punya istri , anak , dan teman .
have we met before ?	apakah kita pernah bertemu sebelumnya ?
everyone makes mistakes .	semua orang pernah melakukan kesalahan .
tom has a stomachache .	tom sakit perut .
do you think so ?	apa kamu pikir begitu ?
whales are mammals .	paus adalah binatang mamalia .
the fountain is over there .	air mancurnya ada di sebelah sana .
i know how much you meant to tom .	aku tahu seberapa berartinya dirimu bagi tom .
tom turned the faucet on .	tom membuka keran .
can you eat raw oysters ?	apa kau bisa memakan tiram mentah ?
no one cared .	tidak ada yang peduli .
she is very intelligent .	dia sangat pintar .
everything s fine .	semua baik baik saja .
mind your own business !	jangan buat kerbau tanduk panjang .
i don t like to wear shoes without socks .	aku tidak suka memakai sepatu tanpa kaus kaki .
i always use iodized salt .	saya selalu menggunakan garam beryodium .
the lion is the king of the jungle .	singa adalah raja rimba .
i tried to save you .	aku mencoba menyelamatkanmu .
she is unable to cope with stress .	dia tidak mampu mengatasi stres .
when will you return ?	kapan kamu akan kembali ?
when did you finish it ?	kapan kamu menyelesaikannya ?
i m deaf .	aku tuli .
tom said that he sees mary at school every day .	tom berkata bahwa dia melihat mary di sekolah setiap hari .
the last time that happened was in 2013 .	terakhir kali itu terjadi tahun 2013 .
do you think that s enough ?	apa kamu pikir itu cukup ?
tom was insane .	tom gila .
smoking is not allowed in this room .	dilarang merokok di ruangan ini .
this is the book that i told you about .	ini buku yang aku ceritakan padamu .
are you sleepy ?	apa kamu ngantuk ?
i opened the window .	aku membuka jendela .
in japan , it s now 3 : 00 a . m .	di jepang , sekarang 3 : 00 pagi .
this is a pen .	ini pulpen .
